[
  {
    "id": "cbi-slv-scenario-item-24",
    "programmeId": "cbi-slv",
    "optionId": "cbi-slv-option-1",
    "claimId": "cbi-slv-scenario-item-24"
  },
  {
    "id": "cbi-slv-scenario-item-25",
    "programmeId": "cbi-slv",
    "optionId": "cbi-slv-option-1",
    "claimId": "cbi-slv-scenario-item-25"
  }
]
