[
  {
    "id": "cbi-lca-cost-9",
    "programmeId": "cbi-lca",
    "optionId": "cbi-lca-option-1",
    "claimId": "cbi-lca-cost-9"
  },
  {
    "id": "cbi-lca-cost-28",
    "programmeId": "cbi-lca",
    "optionId": "cbi-lca-option-1",
    "claimId": "cbi-lca-cost-28"
  },
  {
    "id": "cbi-lca-scenario-item-26",
    "programmeId": "cbi-lca",
    "optionId": "cbi-lca-option-1",
    "claimId": "cbi-lca-scenario-item-26"
  },
  {
    "id": "cbi-lca-scenario-item-27",
    "programmeId": "cbi-lca",
    "optionId": "cbi-lca-option-1",
    "claimId": "cbi-lca-scenario-item-27"
  },
  {
    "id": "cbi-lca-scenario-item-28",
    "programmeId": "cbi-lca",
    "optionId": "cbi-lca-option-1",
    "claimId": "cbi-lca-scenario-item-28"
  },
  {
    "id": "cbi-lca-scenario-item-29",
    "programmeId": "cbi-lca",
    "optionId": "cbi-lca-option-1",
    "claimId": "cbi-lca-scenario-item-29"
  },
  {
    "id": "cbi-lca-scenario-item-30",
    "programmeId": "cbi-lca",
    "optionId": "cbi-lca-option-1",
    "claimId": "cbi-lca-scenario-item-30"
  },
  {
    "id": "cbi-lca-scenario-item-31",
    "programmeId": "cbi-lca",
    "optionId": "cbi-lca-option-1",
    "claimId": "cbi-lca-scenario-item-31"
  },
  {
    "id": "cbi-lca-built-property-single_adult-capital",
    "programmeId": "cbi-lca",
    "optionId": "cbi-lca-built-property",
    "claimId": "cbi-lca-built-property-single_adult-capital"
  },
  {
    "id": "cbi-lca-built-property-single_adult-government_charge",
    "programmeId": "cbi-lca",
    "optionId": "cbi-lca-built-property",
    "claimId": "cbi-lca-built-property-single_adult-government_charge"
  },
  {
    "id": "cbi-lca-built-property-couple_two_children_under12-capital",
    "programmeId": "cbi-lca",
    "optionId": "cbi-lca-built-property",
    "claimId": "cbi-lca-built-property-couple_two_children_under12-capital"
  },
  {
    "id": "cbi-lca-built-property-couple_two_children_under12-government_charge",
    "programmeId": "cbi-lca",
    "optionId": "cbi-lca-built-property",
    "claimId": "cbi-lca-built-property-couple_two_children_under12-government_charge"
  }
]
